,S.N.,Symbol,Company,Units,Price,Opening Date,Closing Date,Status,View
0,1,SMHPL,Super Madi Hydropower Limited,1743000.0,100.0,2023-01-23,2023-01-26,Closed,
1,2,SHUVAM,Shuvam Power Limited,481882.0,100.0,2023-02-01,2023-02-05,Coming Soon,
2,3,MKHCL,Maya Khola Hydropower Company Limited,1992000.0,100.0,2023-01-27,2023-01-31,Open,
3,4,AATMA,Aatmanirbhar Laghubitta Bittiya Sanstha Limited,169755.0,100.0,2023-02-23,2023-02-27,Coming Soon,
4,5,BPW,BPW Laghubitta Bittiya Sanstha Limited,97000.0,100.0,Coming Soon,Coming Soon,Coming Soon,
