,S.N.,Symbol,Company,Units,Price,Opening Date,Closing Date,Status,View
0,1,RULBSL,Rastra Utthan Laghubitta Bittiya Sanstha Limited,850000.0,100.0,2022-02-16,2022-02-20,Closed,
1,2,NSLBSL,Nesdo Sambridha Laghubitta Bittiya Sanstha Limited,828750.0,100.0,2022-02-23,2022-02-27,Coming Soon,
2,3,JSLBS,Jalpa Samudayik Laghubitta Bittiya Sanstha Limited,522000.0,100.0,2022-02-04,2022-02-08,Closed,
3,4,ENL,Emerging Nepal Limited,555600.0,100.0,2022-02-09,2022-02-13,Closed,
4,5,SPC,Samling Power Company Limited,730000.0,100.0,2021-10-21,2021-10-25,Closed,
