,S.N.,Symbol,Company,Units,Price,Opening Date,Closing Date,Status,View
0,1,CHTL,City Hotel Limited,1355940.0,100.0,2023-05-08,2023-05-11,Coming Soon,
1,2,MJS,Makar Jitumaya Suri Hydropower Company Limited,2280000.0,100.0,2023-04-02,2023-04-05,Coming Soon,
2,3,IHL,Ingwa Hydropower Ltd,1800000.0,100.0,Coming Soon,Coming Soon,Coming Soon,
3,4,MKHL,Mai Khola Hydropower Limited,1921568.0,100.0,Coming Soon,Coming Soon,Coming Soon,
4,5,SMJCL,Sagarmatha Jalbidhyut Company Limited,3581760.0,100.0,2023-03-22,2023-03-26,Closed,
