,S.N.,Symbol,Company,Units,Price,Opening Date,Closing Date,Status,View
0,1,KBSHL,Kutheli Bukhari Small Hydropower Limited,101151.0,100.0,2023-07-11,2023-07-14,Coming Soon,
1,2,GCI,Ghorahi Cement Industry Limited,6911670.0,435.0,2023-07-07,2023-07-10,Closed,
2,3,IMELICL,IME Life Insurance Company Limited,9600000.0,236.91,2023-07-06,2023-07-10,Closed,
3,4,MMKJL,Mathillo Mailun Khola Jalvidhyut Limited,2500000.0,100.0,Coming Soon,Coming Soon,Coming Soon,
4,5,CHPL,Chirkhwa Hydro Power Limited,1200000.0,100.0,Coming Soon,Coming Soon,Coming Soon,
