,S.N.,Symbol,Company,Units,Price,Opening Date,Closing Date,Status,View
0,1,DORDI,Dordi Khola Hydropower Company Limited,2195509.0,100.0,2022-06-09,2022-06-14,Coming Soon,
1,2,BHDCL,Bindhyabasini Hydropower Development Company Limited,1500000.0,100.0,2022-06-03,2022-06-08,Open,
2,3,ADARSHA,Adarsha Laghubitta Bittiya Sanstha Limited,67000.0,100.0,Coming Soon,Coming Soon,Coming Soon,
3,4,RFPL,River Falls Power Limited,2730000.0,100.0,2022-05-11,2022-05-18,Closed,
4,5,CYC,CYC Nepal Laghubitta Bittiya Sanstha Limited,395336.0,100.0,2022-04-15,2022-04-19,Closed,
