,S.N.,Symbol,Company,Units,Price,Opening Date,Closing Date,Status,View
0,1,MMKJL,Mathillo Mailun Khola Jalvidhyut Limited,2500000.0,100.0,Coming Soon,Coming Soon,Coming Soon,
1,2,CHPL,Chirkhwa Hydro Power Limited,1200000.0,100.0,Coming Soon,Coming Soon,Coming Soon,
2,3,CLICL,Citizen Life Insurance Company Limited,11250000.0,244.0,Coming Soon,Coming Soon,Coming Soon,
3,4,SNLICL,Sun Nepal Life Insurance Company Limited,9600000.0,239.0,Coming Soon,Coming Soon,Coming Soon,
4,5,MSHCL,Mid Solu Hydropower Company Limited,1496800.0,100.0,Coming Soon,Coming Soon,Coming Soon,
