,S.N.,Symbol,Company,Units,Price,Opening Date,Closing Date,Status,View
0,1,DORDI,Dordi Khola Hydropower Company Limited,2195509.0,100.0,2022-06-09,2022-06-14,Coming Soon,
1,2,BHDCL,Bindhyabasini Hydropower Development Company Limited,1500000.0,100.0,2022-06-03,2022-06-08,Open,
2,3,MAHCL,Mandakini Hydropower Company Limited,1764110.0,100.0,Coming Soon,Coming Soon,Coming Soon,
3,4,SPHL,Sayapatri Hydropower Limited,900000.0,100.0,Coming Soon,Coming Soon,Coming Soon,
4,5,ADARSHA,Adarsha Laghubitta Bittiya Sanstha Limited,67000.0,100.0,Coming Soon,Coming Soon,Coming Soon,
