,S.N.,Symbol,Company,Units,Price,Opening Date,Closing Date,Status,View
0,1,CLICL,Citizen Life Insurance Company Limited,11250000.0,290.0,Coming Soon,Coming Soon,Coming Soon,
1,2,SNLICL,Sun Nepal Life Insurance Company Limited,9600000.0,250.55,Coming Soon,Coming Soon,Coming Soon,
2,3,MSHCL,Mid Solu Hydropower Company Limited,1496800.0,100.0,Coming Soon,Coming Soon,Coming Soon,
3,4,MAHL,Mandu Hydropower Limited,1636370.0,248.0,Coming Soon,Coming Soon,Coming Soon,
4,5,HINL,Hathway Investment Nepal Limited,2925000.0,50.0,Coming Soon,Coming Soon,Coming Soon,
