,S.N.,Symbol,Company,Units,Price,Opening Date,Closing Date,Status,View
0,1,CLICL,Citizen Life Insurance Company Limited,9000000.0,244.0,2023-09-01,2023-09-05,Coming Soon,
1,2,MAHL,Mandu Hydropower Limited,1205320.0,206.0,2023-08-27,2023-08-30,Coming Soon,
2,3,BHPDCL,Bhagawati Hydropower Development Company Limited,712220.0,116.0,2023-08-22,2023-08-25,Open,
3,4,SNLICL,Sun Nepal Life Insurance Company Limited,7680000.0,239.0,2023-08-17,2023-08-21,Closed,
4,5,MEHL,Manakamana Engineering Hydropower Limited,2276620.0,100.0,2023-08-13,2023-08-16,Closed,
